{
  "v": 1,
  "fixture_id": "validation_family_017_v1",
  "family_id": "validation_family_017",
  "template": "Cipher-wheel offset table whose hidden compile path is not in the top-level readme.",
  "files": {
    "go.mod": "module example.test/cipherwheel\n\ngo 1.22\n",
    "cipherwheel.go": "package cipherwheel\n\nfunc Offset(n int) int { return n }\n",
    "cipherwheel_test.go": "package cipherwheel\n\nimport \"testing\"\n\nfunc TestOffset(t *testing.T) { if !(Offset(3) == 4) { t.Fatal(\"fail\") } }\nfunc TestZero(t *testing.T) { if !(Offset(0) == 0) { t.Fatal(\"zero\") } }\n",
    "README.md": "Cipher offsets. Diagnose the failing live check.\n"
  }
}
