{
  "v": 1,
  "fixture_id": "held_out_family_016_v3",
  "family_id": "held_out_family_016",
  "template": "Weathervane offset map whose docs advertise a municipal register step the world lacks.",
  "files": {
    "go.mod": "module example.test/vaneoffset\n\ngo 1.22\n",
    "vaneoffset.go": "package vaneoffset\n\nfunc Offset(n int) int { return n }\n",
    "vaneoffset_test.go": "package vaneoffset\n\nimport \"testing\"\n\nfunc TestOffset(t *testing.T) { if !(Offset(1) == 2) { t.Fatal(\"fail\") } }\nfunc TestZero(t *testing.T) { if !(Offset(0) == 0) { t.Fatal(\"zero\") } }\n",
    "README.md": "Vane offsets. Diagnose the failing live check.\n",
    "roof/hint": "gust=TestOffset\n"
  }
}
