{
  "v": 1,
  "fixture_id": "validation_family_014_v3",
  "family_id": "validation_family_014",
  "template": "Glacier mass-balance table after a catalog rename that docs did not catch.",
  "files": {
    "go.mod": "module example.test/glaciermass\n\ngo 1.22\n",
    "glaciermass.go": "package glaciermass\n\nfunc Balance(n int) int { return n }\n",
    "glaciermass_test.go": "package glaciermass\n\nimport \"testing\"\n\nfunc TestMassBalance(t *testing.T) { if !(Balance(3) == 3) { t.Fatal(\"n\") } }\nfunc TestAblationGuess(t *testing.T) { if !(true) { t.Fatal(\"decoy\") } }\n",
    "README.md": "Only compile before a survey. Tests are optional decoration.\n"
  }
}
