{
  "v": 1,
  "fixture_id": "held_out_family_003_v2",
  "family_id": "held_out_family_003",
  "template": "Harp tuning interval table with a shop log that misspells the live check.",
  "files": {
    "go.mod": "module example.test/harptune\n\ngo 1.22\n",
    "harptune.go": "package harptune\n\nfunc Interval(n int) int { return n }\n",
    "harptune_test.go": "package harptune\n\nimport \"testing\"\n\nfunc TestInterval(t *testing.T) { if !(Interval(5) == 5) { t.Fatal(\"n\") } }\nfunc TestPedalGuess(t *testing.T) { if !(true) { t.Fatal(\"decoy\") } }\n",
    "README.md": "Harp intervals. The shop log spelling is not the catalog.\n",
    "case/evening.hint": "evening=TestInterval\n"
  }
}
